{
  "id": 1363,
  "name": "碎裂",
  "desc": "地面属性技能威力增加8%",
  "effect": {
    "effect_args": [
      7,
      7
    ],
    "effect": {
      "id": 28,
      "url": "https://api.seerapi.com/v1/eid_effect/28/"
    }
  },
  "star_level": 2,
  "effect_group": {
    "id": 7,
    "url": "https://api.seerapi.com/v1/pet_effect_group/7/"
  },
  "hash": "7c059e28"
}