{
  "id": 1019,
  "name": "奇异",
  "desc": "神秘属性技能威力增加5%",
  "effect": {
    "effect_args": [
      14,
      5
    ],
    "effect": {
      "id": 28,
      "url": "https://api.seerapi.com/v1/eid_effect/28/"
    }
  },
  "star_level": 0,
  "effect_group": {
    "id": 14,
    "url": "https://api.seerapi.com/v1/pet_effect_group/14/"
  },
  "hash": "f02707c8"
}